{
  "workflow_id": "implementation",
  "feature_id": "feat-reveal-intent",
  "iteration": 1,
  "timestamp": "2026-08-29T11:18:03Z",
  "overall_status": "pass",
  "checks": [
    { "name": "lint", "status": "pass", "exit_code": 0, "duration_ms": null, "output_summary": null },
    { "name": "typecheck", "status": "pass", "exit_code": 0, "duration_ms": null, "output_summary": null },
    { "name": "test", "status": "pass", "exit_code": 0, "duration_ms": null, "output_summary": null },
    { "name": "build", "status": "pass", "exit_code": 0, "duration_ms": null, "output_summary": null }
  ],
  "findings": [],
  "metadata": {
    "git_branch": "main",
    "git_commit": null,
    "changed_files": [
      "lib/review-workspace/evidence-format.ts",
      "lib/review-workspace/loader.ts",
      "app/page.tsx",
      "app/components/FindingsPane.tsx",
      "app/components/IntentPanel.tsx",
      "app/__tests__/reveal-intent.test.tsx"
    ],
    "contract_path": ".agent/contracts/contract-feat-reveal-intent.json",
    "previous_report": null
  }
}
