{
  "workflow_id": "verification",
  "feature_id": "feat-core-review-workspace",
  "iteration": 2,
  "timestamp": "2026-08-29T15:48:53Z",
  "overall_status": "pass",
  "checks": [
    {
      "name": "lint",
      "status": "pass",
      "exit_code": 0,
      "duration_ms": null,
      "output_summary": "0 errors. 8 warnings — all pre-existing in frozen Feature 1/2 test files (lib/analysis/__tests__/behavioral-contract.test.ts, data-foundation.test.ts). No new warnings introduced by Feature 3."
    },
    {
      "name": "typecheck",
      "status": "pass",
      "exit_code": 0,
      "duration_ms": null,
      "output_summary": "tsc --noEmit produced no output. Clean."
    },
    {
      "name": "test",
      "status": "pass",
      "exit_code": 0,
      "duration_ms": 384,
      "output_summary": "3 test files. 55 tests passed. 0 failed. 0 skipped. lib/behavioral-contract: 20 pass. lib/data-foundation: 25 pass. app/review-workspace: 10 pass (TEST-201 through TEST-210)."
    },
    {
      "name": "build",
      "status": "pass",
      "exit_code": 0,
      "duration_ms": null,
      "output_summary": "next build (Turbopack). Compiled successfully. TypeScript check passed. Route / and /_not-found generated as static content."
    }
  ],
  "findings": [],
  "metadata": {
    "git_branch": "main",
    "git_commit": "583d0bfaa8fa4131f1cfdf2623790716334a4442",
    "changed_files": [
      "app/globals.css",
      "app/layout.tsx",
      "app/page.tsx",
      "package.json",
      "package-lock.json",
      "vitest.config.ts",
      "vitest.setup.ts",
      "app/__tests__/review-workspace.test.tsx",
      "app/components/DiffPane.tsx",
      "app/components/FindingsPane.tsx",
      "app/components/ReviewHeader.tsx",
      "lib/review-workspace/confidence.ts",
      "lib/review-workspace/diff.ts",
      "lib/review-workspace/loader.ts"
    ],
    "contract_path": ".agent/contracts/contract-feat-core-review-workspace.json",
    "previous_report": ".agent/reports/history/20260829-104631-implementation.json"
  }
}
