{
  "workflow_id": "security-review",
  "feature_id": "feat-core-review-workspace",
  "iteration": 1,
  "timestamp": "2026-08-29T10:51:49Z",
  "overall_status": "pass",
  "checks": [
    {
      "name": "authentication-authorisation",
      "status": "pass",
      "exit_code": null,
      "duration_ms": null,
      "output_summary": "No routes, API endpoints, server actions, or authenticated resources. Static read-only workspace. N/A."
    },
    {
      "name": "input-validation",
      "status": "pass",
      "exit_code": null,
      "duration_ms": null,
      "output_summary": "No user input. All content from Zod-validated fixture JSON. WireSchema.parse() enforces type, enum, and range constraints before any field access."
    },
    {
      "name": "output-handling",
      "status": "pass",
      "exit_code": null,
      "duration_ms": null,
      "output_summary": "No dangerouslySetInnerHTML. All content rendered as React text nodes. XSS escaping applied by React default."
    },
    {
      "name": "injection",
      "status": "pass",
      "exit_code": null,
      "duration_ms": null,
      "output_summary": "No SQL, shell, template, LDAP, XPath, or XML injection vectors found."
    },
    {
      "name": "ssrf",
      "status": "pass",
      "exit_code": null,
      "duration_ms": null,
      "output_summary": "No outbound HTTP/HTTPS requests. No fetch, no axios, no external URL construction."
    },
    {
      "name": "path-traversal",
      "status": "pass",
      "exit_code": null,
      "duration_ms": null,
      "output_summary": "No filesystem access at runtime. Fixture JSON imported as static ES modules resolved at build time."
    },
    {
      "name": "secret-exposure",
      "status": "pass",
      "exit_code": null,
      "duration_ms": null,
      "output_summary": "No hard-coded secrets, API keys, tokens, or credentials found. No process.env access. No NEXT_PUBLIC_ vars."
    },
    {
      "name": "dependency-security",
      "status": "fail",
      "exit_code": null,
      "duration_ms": null,
      "output_summary": "happy-dom@15.11.7 has 3 CVEs: GHSA-37j7-fg3j-429f (critical, RCE), GHSA-6q6h-j7hj-3r64 (high, code exec), GHSA-w4gp-fjgq-3q4g (high, cookie leak). Dev-only. Fix: upgrade to ^20.11.15."
    },
    {
      "name": "unsafe-configuration",
      "status": "pass",
      "exit_code": null,
      "duration_ms": null,
      "output_summary": "tsconfig strict:true. next.config.ts: no dangerouslyAllowSVG, no CORS, no exposed env vars. happy-dom scoped to test env only."
    }
  ],
  "findings": [
    {
      "id": "sec-001",
      "severity": "medium",
      "category": "dependency",
      "file": "package.json",
      "line": 27,
      "message": "happy-dom@15.11.7 is within the affected version range of three published CVEs: GHSA-37j7-fg3j-429f (critical, VM context escape / RCE, affects <20.0.0), GHSA-6q6h-j7hj-3r64 (high, unsanitized export names → code execution, affects >=15.10.0 <=20.8.7), GHSA-w4gp-fjgq-3q4g (high, fetch credential leak, affects <20.8.9). Package is a devDependency used only in vitest happy-dom test environment, not included in the production bundle.",
      "evidence": "npm audit: 1 critical vulnerability, range <=20.8.8, happy-dom. Installed: 15.11.7. CVEs: GHSA-37j7-fg3j-429f, GHSA-6q6h-j7hj-3r64, GHSA-w4gp-fjgq-3q4g.",
      "suggested_action": "Upgrade happy-dom to ^20.11.15 in devDependencies. This is a major-version bump (15.x → 20.x). Verify no breaking API changes in vitest.config.ts or app/__tests__/review-workspace.test.tsx before upgrading. The fix does not require changes to application source files.",
      "reproducible": true,
      "status": "open",
      "resolved_at": null,
      "resolved_by": null
    }
  ],
  "metadata": {
    "git_branch": "main",
    "git_commit": "583d0bfaa8fa4131f1cfdf2623790716334a4442",
    "changed_files": [
      "app/globals.css",
      "app/layout.tsx",
      "app/page.tsx",
      "package.json",
      "vitest.config.ts",
      "vitest.setup.ts",
      "app/__tests__/review-workspace.test.tsx",
      "app/components/DiffPane.tsx",
      "app/components/FindingsPane.tsx",
      "app/components/ReviewHeader.tsx",
      "lib/review-workspace/confidence.ts",
      "lib/review-workspace/diff.ts",
      "lib/review-workspace/loader.ts"
    ],
    "contract_path": ".agent/contracts/contract-feat-core-review-workspace.json",
    "previous_report": null
  }
}
