{
  "workflow_id": "implementation",
  "feature_id": "feat-guardrail-test",
  "iteration": 1,
  "timestamp": "2026-08-29T11:48:36Z",
  "overall_status": "pass",
  "checks": [
    {
      "name": "lint",
      "status": "pass",
      "exit_code": 0,
      "duration_ms": null,
      "output_summary": "PASS: lint"
    },
    {
      "name": "typecheck",
      "status": "pass",
      "exit_code": 0,
      "duration_ms": null,
      "output_summary": "PASS: typecheck"
    },
    {
      "name": "test",
      "status": "pass",
      "exit_code": 0,
      "duration_ms": 449,
      "output_summary": "Test Files: 5 passed (5) | Tests: 77 passed (77)"
    },
    {
      "name": "build",
      "status": "pass",
      "exit_code": 0,
      "duration_ms": null,
      "output_summary": "PASS: build"
    }
  ],
  "findings": [],
  "metadata": {
    "git_branch": "main",
    "git_commit": "9f9292aef9446a4e8f6d1dffcb8d2a8e6d0a9bae",
    "changed_files": [
      "app/components/FindingsPane.tsx",
      "app/page.tsx",
      "lib/review-workspace/loader.ts",
      "app/__tests__/guardrail-test.test.tsx",
      "app/components/GuardrailTestView.tsx",
      "lib/analysis/fixtures/meridian-sample-guardrail-test.json",
      "lib/analysis/guardrail-test.ts"
    ],
    "contract_path": ".agent/contracts/contract-feat-guardrail-test.json",
    "previous_report": null
  }
}
