{
  "workflow_id": "implementation",
  "feature_id": "feat-bob-analysis-pipeline",
  "iteration": 2,
  "timestamp": "2025-01-01T00:00:00Z",
  "overall_status": "pass",
  "checks": [
    {
      "name": "lint",
      "status": "pass",
      "exit_code": 0,
      "output_summary": "0 errors, 16 pre-existing warnings (none in changed files)"
    },
    {
      "name": "typecheck",
      "status": "pass",
      "exit_code": 0,
      "output_summary": "tsc --noEmit completed with no errors"
    },
    {
      "name": "test",
      "status": "pass",
      "exit_code": 0,
      "output_summary": "110 tests pass. 4 pre-existing failures in app/__tests__/bob-analysis-pipeline.test.tsx (badge text mismatch, pre-existing before this correction)"
    }
  ],
  "findings": [
    {
      "id": "scope-001",
      "severity": "info",
      "category": "scope",
      "file": "app/__tests__/bob-analysis-pipeline.test.tsx",
      "line": null,
      "message": "4 pre-existing test failures in this file exist on baseline before this correction. Tests look for 'LIVE BOB ANALYSIS' and 'DEVELOPMENT FIXTURE' text but ReviewHeader renders abbreviated 'Live' and 'Fixture' badges. Not caused by this change.",
      "evidence": "TEST-614, TEST-615, 'renders DEVELOPMENT FIXTURE badge on initial load', TEST-618 all fail on git stash (baseline).",
      "suggested_action": "A separate fix to ReviewHeader badge text or tests is needed. Outside scope of this transport correction.",
      "reproducible": true,
      "status": "accepted_risk",
      "resolved_at": null,
      "resolved_by": null
    }
  ],
  "metadata": {
    "git_branch": "main",
    "git_commit": "27c7b985c7e8d01f31b9068e4038f301f4ec0323",
    "changed_files": [
      "lib/analysis/bob-client.ts",
      "lib/analysis/__tests__/bob-pipeline.test.ts"
    ],
    "contract_path": ".agent/contracts/contract-feat-bob-analysis-pipeline.json",
    "previous_report": ".agent/reports/latest.md"
  }
}
