{
  "workflow_id": "security-review",
  "feature_id": "feat-reveal-intent",
  "iteration": 1,
  "timestamp": "2026-08-29T11:25:04Z",
  "overall_status": "pass",
  "checks": [
    { "name": "authentication-authorisation", "status": "pass", "exit_code": null, "duration_ms": null, "output_summary": "No auth surface — static Server Component page, no users, no sessions." },
    { "name": "input-validation", "status": "pass", "exit_code": null, "duration_ms": null, "output_summary": "All data flows through RevealIntentWireSchema.parse() before any field access. No user input." },
    { "name": "output-handling", "status": "pass", "exit_code": null, "duration_ms": null, "output_summary": "All rendering uses React JSX text nodes. No dangerouslySetInnerHTML, no eval, no innerHTML." },
    { "name": "injection", "status": "pass", "exit_code": null, "duration_ms": null, "output_summary": "No SQL, shell commands, template injection, or XML processing." },
    { "name": "ssrf", "status": "pass", "exit_code": null, "duration_ms": null, "output_summary": "No outbound HTTP requests. All data is static bundled JSON." },
    { "name": "path-traversal", "status": "pass", "exit_code": null, "duration_ms": null, "output_summary": "No runtime file system access. shortFilePath operates on strings for display only." },
    { "name": "secret-exposure", "status": "pass", "exit_code": null, "duration_ms": null, "output_summary": "No secrets, API keys, process.env references, or NEXT_PUBLIC_ variables." },
    { "name": "dependency-security", "status": "pass", "exit_code": null, "duration_ms": null, "output_summary": "No dependencies added or changed." },
    { "name": "unsafe-configuration", "status": "pass", "exit_code": null, "duration_ms": null, "output_summary": "strict:true set. No dangerouslyAllowSVG. No wildcard CORS. CSP missing (pre-existing info finding)." }
  ],
  "findings": [
    {
      "id": "sec-001",
      "severity": "info",
      "category": "configuration",
      "file": "next.config.ts",
      "line": null,
      "message": "No HTTP security headers (Content-Security-Policy, X-Frame-Options, X-Content-Type-Options, Referrer-Policy) are configured in next.config.ts. This is a pre-existing condition accepted for the hackathon MVP prototype per PRD §NFR-006.",
      "evidence": "next.config.ts contains only reactCompiler: true — no headers() configuration.",
      "suggested_action": "Before any production deployment, add a headers() export to next.config.ts that sets at minimum: Content-Security-Policy (restrict script-src to 'self'), X-Frame-Options: DENY, X-Content-Type-Options: nosniff, and Referrer-Policy: strict-origin-when-cross-origin. The property to preserve is that the application cannot be framed by untrusted origins and that MIME-sniffing attacks are mitigated.",
      "reproducible": true,
      "status": "accepted_risk",
      "resolved_at": null,
      "resolved_by": null
    }
  ],
  "metadata": {
    "git_branch": "main",
    "git_commit": null,
    "changed_files": [
      "lib/review-workspace/evidence-format.ts",
      "lib/review-workspace/loader.ts",
      "app/page.tsx",
      "app/components/FindingsPane.tsx",
      "app/components/IntentPanel.tsx",
      "app/__tests__/reveal-intent.test.tsx"
    ],
    "contract_path": ".agent/contracts/contract-feat-reveal-intent.json",
    "previous_report": ".agent/reports/history/20260829-105149-security.json"
  }
}
