{
  "$schema": ".agent/reports/report-schema.json",
  "workflow_id": "verification",
  "feature_id": null,
  "iteration": 1,
  "timestamp": "2026-08-28T16:08:37Z",
  "overall_status": "pass",
  "checks": [{
      "name": "lint",
      "status": "pass",
      "exit_code": 0,
      "duration_ms": null,
      "output_summary": "\n> legacy-lens@0.1.0 lint\n> eslint"
    },{
      "name": "typecheck",
      "status": "pass",
      "exit_code": 0,
      "duration_ms": null,
      "output_summary": ""
    },{
      "name": "test",
      "status": "skipped",
      "exit_code": null,
      "duration_ms": null,
      "output_summary": "Skipped: no 'test' or 'test:ci' script in package.json"
    },{
      "name": "build",
      "status": "pass",
      "exit_code": 0,
      "duration_ms": null,
      "output_summary": "\n> legacy-lens@0.1.0 build\n> next build\n\n▲ Next.js 16.3.3 (Turbopack)\n✓ Running next.config.ts took 67ms\n\n  Creating an optimized production build ...\n✓ Compiled successfully in 7.3s\n  Running TypeScript ...\n  Finished TypeScript in 712ms ...\n  Collecting page data using 5 workers ...\n  Generating static pages using 5 workers (0/4) ...\n  Generating static pages using 5 workers (1/4) \r\n  Generating static pages using 5 workers (2/4) \r\n  Generating static pages using 5 workers (3/4) \r\n✓ Generating"
    }],
  "findings": [],
  "metadata": {
    "git_branch": "main",
    "git_commit": "4d5ff574f767e187592759736c912cee4494bb15",
    "changed_files": [],
    "contract_path": null,
    "previous_report": null
  }
}
