{
  "workflow_id": "implementation",
  "feature_id": "feat-core-review-workspace",
  "iteration": 1,
  "timestamp": "2026-08-29T10:46:31Z",
  "overall_status": "pass",
  "checks": [
    {
      "name": "test",
      "status": "pass",
      "exit_code": 0,
      "duration_ms": 409,
      "output_summary": "3 test files passed. 55 tests passed (20 lib-behavioral-contract + 25 lib-data-foundation + 10 app-review-workspace). 0 failures."
    },
    {
      "name": "lint",
      "status": "pass",
      "exit_code": 0,
      "duration_ms": null,
      "output_summary": "0 errors. 8 pre-existing warnings in frozen Feature 1/2 test files."
    },
    {
      "name": "typecheck",
      "status": "pass",
      "exit_code": 0,
      "duration_ms": null,
      "output_summary": "No output — clean."
    },
    {
      "name": "build",
      "status": "pass",
      "exit_code": 0,
      "duration_ms": null,
      "output_summary": "Compiled successfully. Static pages generated. Route / and /_not-found."
    }
  ],
  "findings": [],
  "metadata": {
    "git_branch": "main",
    "git_commit": "583d0bfaa8fa4131f1cfdf2623790716334a4442",
    "changed_files": [
      "app/globals.css",
      "app/layout.tsx",
      "app/page.tsx",
      "package.json",
      "package-lock.json",
      "vitest.config.ts",
      "vitest.setup.ts",
      "app/__tests__/review-workspace.test.tsx",
      "app/components/DiffPane.tsx",
      "app/components/FindingsPane.tsx",
      "app/components/ReviewHeader.tsx",
      "lib/review-workspace/confidence.ts",
      "lib/review-workspace/diff.ts",
      "lib/review-workspace/loader.ts"
    ],
    "contract_path": ".agent/contracts/contract-feat-core-review-workspace.json",
    "previous_report": null
  }
}
