{
  "workflow_id": "security-review",
  "feature_id": "feat-data-foundation",
  "iteration": 1,
  "timestamp": "2026-08-29T10:30:00Z",
  "overall_status": "pass",
  "checks": [
    {
      "name": "auth-authz",
      "status": "pass",
      "exit_code": null,
      "duration_ms": null,
      "output_summary": "No routes, API endpoints, server actions, or data access introduced. Not applicable."
    },
    {
      "name": "input-validation",
      "status": "pass",
      "exit_code": null,
      "duration_ms": null,
      "output_summary": "All four wire schemas use Zod strict typing: enum fields via z.enum(), numeric fields with .int().min(0), confidence with .min(0).max(1), timestamps with .datetime(). No raw 'as' assertions on untrusted input in production code. Mapper functions receive Zod-typed Wire arguments only."
    },
    {
      "name": "output-handling",
      "status": "pass",
      "exit_code": null,
      "duration_ms": null,
      "output_summary": "No UI rendering, HTML templates, or log output. Not applicable."
    },
    {
      "name": "injection",
      "status": "pass",
      "exit_code": null,
      "duration_ms": null,
      "output_summary": "No exec, spawn, child_process, eval, SQL, or template rendering. Not applicable."
    },
    {
      "name": "ssrf",
      "status": "pass",
      "exit_code": null,
      "duration_ms": null,
      "output_summary": "No outbound HTTP requests. Not applicable."
    },
    {
      "name": "path-traversal",
      "status": "pass",
      "exit_code": null,
      "duration_ms": null,
      "output_summary": "No filesystem operations. Not applicable."
    },
    {
      "name": "secret-exposure",
      "status": "pass",
      "exit_code": null,
      "duration_ms": null,
      "output_summary": "No process.env access, API keys, tokens, or credentials in any new file. Fixtures contain only demo Java source references, no real credentials."
    },
    {
      "name": "dependency-security",
      "status": "pass",
      "exit_code": null,
      "duration_ms": null,
      "output_summary": "No new dependencies added. zod@4.4.3 (runtime) and vitest@^4.1.11 (dev) were pre-existing from Feature 1."
    },
    {
      "name": "configuration",
      "status": "pass",
      "exit_code": null,
      "duration_ms": null,
      "output_summary": "tsconfig.json strict:true confirmed. No changes to next.config.ts. No new NEXT_PUBLIC_ env vars. No CSP or CORS changes introduced."
    }
  ],
  "findings": [
    {
      "id": "sec-001",
      "severity": "info",
      "category": "security",
      "file": "lib/analysis/__tests__/data-foundation.test.ts",
      "line": 420,
      "message": "Type assertions 'as { nodes: ... }' and 'as { edges: ... }' are applied to statically imported JSON fixture data in TEST-125. This is not a trust-boundary issue — the fixture is a static build-time artifact, not runtime-untrusted input. Noted for completeness.",
      "evidence": "Line 420: (blastRadiusFixture as { nodes: { id: string }[] }).nodes.map(...)\nLine 423: blastRadiusFixture as { edges: { source: string; target: string }[] }",
      "suggested_action": "No action required. The assertions are on a statically imported compile-time JSON file. If the test is refactored to use runtime-parsed fixture input, replace the assertions with a Zod parse call instead.",
      "reproducible": true,
      "status": "accepted_risk"
    }
  ],
  "metadata": {
    "git_branch": "main",
    "git_commit": null,
    "changed_files": [
      "lib/analysis/review.ts",
      "lib/analysis/intent.ts",
      "lib/analysis/blast-radius.ts",
      "lib/analysis/metadata.ts",
      "lib/analysis/fixtures/meridian-sample-review.json",
      "lib/analysis/fixtures/meridian-sample-intent.json",
      "lib/analysis/fixtures/meridian-sample-blast-radius.json",
      "lib/analysis/fixtures/meridian-sample-metadata.json",
      "lib/analysis/__tests__/data-foundation.test.ts"
    ],
    "contract_path": ".agent/contracts/contract-feat-data-foundation.json",
    "previous_report": null
  }
}
